,client,title,pos_review,neg_review,nationality,score,travel_type,room_type,date_review
798,Pe,Estancia normal,"El tamaño de la habitación, cama cómoda y amplia. El desayuno correcto.","El mueble de tv está para renovar, la wifi fatal no llegaba bien al primer piso. Pedimos unas zapatillas y nos las negaron diciendo que por protocolo Covid, pues precisamente por eso se dá al cliente que las pide unas de un sólo uso al igual que las demás amenities de hotel.",España,"5,0",En pareja,Habitación Doble - 1 o 2 camas,18/01/2022
799,Raquel,Bien,Relacion calidad precio,"Instalaciones 7 un poco dejadas, puertas de las habitaciones sin pintura y arañazos",España,"7,0",En grupo,Habitación Familiar,17/01/2022
800,Maria,lamentablemente,nada,"realizó una reserva donde Booking.com, que se supone que ustedes trabajan con ellos realizando reservas para su hotel  , realizó una reserva donde hay unas habitaciones reformadas y me dan una habitación sin reformar y con moqueta que soy alérgico a los ácaros y sucio, muebles quemados por cigarros, reclamó y me dicen los empleados del hotel que es lo que yo he reservado y si tengo algún problema que reclame a Booking.com. el desayuno al realizar la Servando pone 8€ por persona y luego nos cobran 12,50€ por persona , por desgracia tuvimos un accidente que regresamos a España y solo hicimos huso un solo día de los 4 días que pagamos y los empleados del hotel nos dicen que ellos no pueden hacer nada y que reclamemos a Booking.com que son los que han hecho la reserva, me siento timado por parte del hotel .
Deseo q se me devuelva el dinero de las tres noches que no he utilizado.",España,"1,0",En pareja,Habitación Doble - 1 o 2 camas,16/01/2022
801,Ismael,recepcionista amargada Jode estancia,la amplitud de la habitacion.,la señora de la recepción hace que mi alojamiento baje de 10 puntos (excelente ) a 4 la estancia,España,"5,0",En pareja,Habitación Doble - 1 o 2 camas,14/01/2022
802,Sanchez,Con algunas mejoras,"El servicio y la atención del personal del restaurante como anotación más destacada.
Personal de limpieza y recepción perfecto.","No tuvimos la habitación que contratamos. Mobiliario con muchos golpes, la puerta del baño inflada por la humedad. Colchón muy blando.",España,"5,0",En pareja,Habitación Doble - 1 o 2 camas,13/01/2022
803,Josep,Hotel regular,Habitación era grande y con dos baños,El desayuno no podias ni moverte al coger la comida. Muy poco espacio. Nos digeron que el parquing estaba lleno.,España,"6,0",En familia,Habitación Cuádruple Estándar,8/01/2022
804,Sergio,decepción,buena ubicación,"tuvimos un accidente que requería atención médica y nos vimos obligados a abandonar la habitación un día antes de lo previsto. Nos cobraron la noche, pero nos prometieron que nos enviarían via email, para poder disfrutar de otra noche en su establecimiento. Nunca llegó ese email, entiendo que fue para contentarnos en ese momento. No resulta muy profesional engañar al cliente, sabiendo y viendo que fue por una causa mayor.",España,"6,0",En pareja,Habitación Doble - 1 o 2 camas,8/01/2022
805,Mar,muchas cosas a mejorar,"la carta del restaurante q era de 10 , y la ubicacion",el trato del personal,España,"6,0",En familia,Habitación Triple,8/01/2022
806,Enrique,Fotos engañosas de la realidad,La atención del personal. Se esmeraban en hacerlo bien,"La limpieza era mas bien poca. La habitación estaba muy trotada, nada que ver con las fotos. Parecia que tenia 50 años de uso.
El personal se esmeraba en el trato, fue lo único bueno pues en general no debería ser un 4 estrellas, como mucho 2 o 3.",España,"5,0",En familia,Habitación Triple,5/01/2022
807,Purificacion,Agradable,El personal y la ubicación,"las camas al lado de la puerta y justo al lado del ascensor. 
Nos costó mucho dormir",España,"6,0",En familia,Habitación Cuádruple Estándar,3/01/2022
808,Xavier,Buena ubicación,"Ubicacion excelente, desayuno correcto y parquing lleno aunque hay buenas alternativas en el exterior",La wifi funcionaba fatal en la habitación y en Andorra es básica,España,"7,0",En familia,Habitación Triple,3/01/2022
809,Elena,Bien,"limpieza
ubicación
desayuno muy completo",wifi- no llegaba a la habitacion,España,"7,0",En grupo,Habitación Cuádruple Estándar,3/01/2022
810,Nuria,Decepcionante,el personal amable,la reserva no correspondia a lo que yo pacté. no había buen wifi.,España,"4,0",En familia,Habitación Triple,3/01/2022
811,Yolanda,Aceptable,"ya hemos estado varies veces y siempre perfecto. 
la situación del hotel sobretodo, y la habitación.","pero esta vez, estábamos en un habitación en el primer piso, que se oía todo. 
y el internet no funcionó en toda la estancia.",España,"5,0",En familia,Habitación Cuádruple Estándar,1/01/2022
812,Rosa,Muy mal,Me parece un abuso que al liquidar la estancia se incremente en un porcentaje abusivo la cuenta por un exceso de ocupación. Este punto lo voy a compartir en todas las plataformas que pueda.,,España,"2,0",En grupo,Habitación Cuádruple Estándar,28/12/2021
813,Jenifer,Agradable,ubicación,la moqueta con polvo y las habitaciones un poco dejadas y descuidadas,España,"6,0",En pareja,Habitación Doble - 1 o 2 camas,14/12/2021
814,Aurora,Aceptable,El personal es amable.,"Desayuno muy mejorable, el primer día había tres naranjas y el segundo ninguna (pregunté y la respuesta...NO, NO HAY). El tercer día desayunamos fuera del Hotel
La limpieza de la habitación... lamentable. Movimos una mesilla y allí había de todo. Creo que pasar una aspiradora por lo menos cuando se cambia de cliente deberían planteárselo. Y si limpiaran la tapicería del sofá cama o mejor las cambiaran sería de aprobado.",España,"5,0",En familia,Habitación Cuádruple Estándar,9/12/2021
815,Olga,Aceptable,Ubicacion,"Habitacionds viejas, para nada modernas mobiliario muy viejo. Relacion calidad precio fatal. Por el estilo de hotel es carissimo!",España,"5,0",En pareja,Habitación Doble - 1 o 2 camas,9/12/2021
816,Marga,No volveremos,"El día de nuestra llegada encontramos en la nevera de la habitación una botella de agua abierta y utilizada hasta la mitad.
Al irnos a acostar y abrir la cama me encontré pegado en la sábana un pòsit con el nombre de ROSA escrito en él.
Al bajar a recepción y comentarlo a la señorita se sorprendió , pidió disculpas y ya.
Sinceramente lo de la botella de agua abierta y usada en el momento en que nos encontramos me pareció muy grave y lo del pòsit....
El personal del restaurante ha sido  muy amable.",,España,"6,0",En familia,Habitación Triple,8/12/2021
817,Cristian,comodidad y cercanía con la calle principal,sobre todo la ubicación,precio alto,España,"7,0",En pareja,Habitación Doble Deluxe,7/12/2021
818,Jesica,Le falta una buena reforma,ubicación,"No parece un establecimiento de 4 estrellas. Las habitaciones necesitan una reforma.
Baño con moho, puertas bufadas, colchón curvado",España,"4,0",En grupo,Habitación Individual,29/11/2021
819,Silvia,ubicacion 10 restó un 5,"cuando llegamos éramos 2 adultos y una niña de 14 años y su cama no estaba preparada. Nos comentaron que teníamos que hacer un cambio de habitación. la ubicación un 10, pero el wifi se iba y venía .., un rollo …","el wifi, los colchones mucho que desear",España,"5,0",En familia,Habitación Triple,25/11/2021
820,Mireia,En la 511 no llega el wifi,"Me gusto que la habitación tubiera dos baños. 
Los cojines son muy cómodos.
El desayuno buffet está muy completo.","La habitación tenia la ducha con pelos y no hay escobillas.
El internet si pasas de la puerta lo pierdes, no llega. Estabamos en la 511. Incluso la tv q es smart tv, pierde la conexión. 
Los colchones son de muelles.",España,"6,0",En grupo,Habitación Cuádruple Deluxe,22/11/2021
821,Maria,Buena y tranquila,La cama por su tamaño grande,La habitación estándar le hace falta una reforma en el mobiliario está bastante viejos y golpeados,España,"7,0",En pareja,Habitación Doble - 1 o 2 camas,30/10/2021
822,Letizia,Estancia céntrica.,"Ubicado cerca de la zona comercial. 
Habitaciones aisladas del ruido. 
Buena higiene.","He seleccionado este hotel por la ubicación y la disponibilidad de recarga para vehículos eléctricos. Sin embargo,  al llegar al hotel y solicitar dicha plaza de recarga, la asistente en turno en recepción me pregunta si tengo cable conector?. 
Después me informa que no sabe dónde se encuentra dicha plaza y que tiene que hablar con alguien de mantenimiento. 
Mientras espero dicha información, me instalo en la habitación. 
Transcurridos 15 minutos acudo nuevamente a preguntar acerca del parking  y me dicen que van a ver si pueden disponer de ella porque hay que solicitarla anticipadamente. 
Además, hay que pagar por el uso de la misma (el costo sale más caro que una estación pública) y además hay que sumar los 18€ por derecho a aparcar en el hotel con plazas de  parking muy reducidas. 
Para cualquier coche o un SUV rozan las puertas con otros coches al salir. 
Hay que maniobrar demasiado  para aparcar en el parking subterráneo. 
Colchón de la cama muy blando.
Muebles y decoración un poco antigua. 
Precio del parking de este hotel es limitado en plazas y más caro que un parking público localizado a 400-500 mts con plazas amplias y vídeo vigilancia. 
Personal poco sociable. 
Las fotos  de publicidad en booking con mobiliario nuevo no correspondían al de mi habitación que tenía muebles antiguos.",Italia,"7,0",Persona que viaja sola,Habitación Individual,23/10/2021
823,Carlota,Aceptable,Buena ubicación,Camas y almohadas incómodas. No atendieron la petición de cama doble.,España,"5,0",En pareja,Habitación Doble Deluxe,22/10/2021
824,Javier,Decepcionante,"La atención al cliente/usuario. Mucha amabilidad pero no saben expresarse con claridad y concreción. Las explicaciones en el funcionamiento del Parking, no solo son imprecisas sino que generan duda en el funcionamiento.",,España,"4,0",En familia,Habitación Cuádruple Estándar,14/10/2021
825,Blanca,"Habitacion buena para familias,le falta cuidar los detalles de la habitacion","El desayuno bien, nada especial, correcto",El mobiliario poco cuidado,España,"6,0",En pareja,Habitación Doble - 1 o 2 camas,15/09/2021
826,Bruno,PROPIETARIO INVIERTA ALGO EN ARREGLOS!,"La ubicación es perfecta, el personal agradable, el desayuno es correcto però sin más.","El propietario del hotel se podria gastar un poco de dinero  en el mantenimiento ya que la pica del baño estaba rota y pintada con un parche, las luces parece que da miedo ponerlas algo mas potentes por si se ven los desperfectos, el parquet destrozado, las mamparas de bañera y la ducha  pierden por todos lados, y la limpieza escasea, de echo cuando llegamos habia un palillo en el suelo y cuando nos fuimos despues de 4 dias seguia allí.
Hablo solo por la experiència de mi habitacion la 204.",España,"4,0",En familia,Habitación Triple,10/09/2021
827,Anna,Correcto,WiFi muy lenta,,España,"7,0",En familia,Habitación Cuádruple Estándar,6/09/2021
828,Miquel,Aceptable,Habitación muy amplia para la familia,Temperatura alta excesiva. El aire acondicionado no enfriaba lo suficiente para las dimensiones de la habitación,España,"5,0",En familia,Habitación Triple,4/09/2021
829,Maria,Nos alojamos 2 adultos y 2 niñas en una habitación cuádruple.,Lo que más me a gustado es el servicio de limpieza de la habitación.,"Las habitaciones tienen los muebles muy estropeados y la puerta del baño está deteriorada, no se corresponde con un 4 estrellas.",España,"6,0",En familia,Habitación Cuádruple Estándar,29/08/2021
830,Cristina,Buena ubicación,"Muy cerca del centro, y un buen desayuno.",,España,"7,0",En familia,Habitación Cuádruple Estándar,26/08/2021
831,Jordi,Bien,"Que entras a las 16:00 y tienes que salir a las 12:00 , pagas por 20 horas de estancia y encima sin párking, porque estaba todo ocupado en fin un poco desastre tienen que avisar antes de coger el hotel ,yo personalmente hubiera cambiado",,España,"7,0",En grupo,Habitación Doble - 1 o 2 camas,21/08/2021
832,J,Bien,La atención en recepción en Check-In muy mal...,,España,"7,0",En familia,Habitación Cuádruple Deluxe,17/08/2021
833,Gemma,Agradable,Ubicación,Ruido a las 8 del servicio de limpieza. Desperfectos en mobiliario habitación. No parece un hotel de 4 estrellas.,España,"6,0",En familia,Habitación Triple,12/08/2021
834,Edgar,Bien,La ubicación del hotel.,"Poca variedad en el desayuno.El hotel no da  servicio de cafetería para tomar un café, un sandwich...
La habitación bastante limpia pero marcos,paredes y mobiliario estaban estropeados.",España,"7,0",En familia,Habitación Cuádruple Estándar,11/08/2021
835,Monicaserrac,Bien,"No llega el wifi en todas las habitaciones,  en la nuestra que estaba en el hueco de la escalera sin wi-fi completamente",,España,"7,0",En familia,Habitación Cuádruple Estándar,9/08/2021
836,Ernesto,Bien,La ubicación.,El desayuno mas variado,España,"7,0",En familia,Habitación Doble - 1 o 2 camas,3/08/2021
837,Maica,Todo correcto excepto la persona de recepción,"La señora de recepción no sirve para estar en recepción, le falta bastante educación.
Me dejó de mentirosa después de haberme dicho q estaba en la obligación de llevar DNI d mis hijos menores de 3 años y q si no los tenía debía llamar a la policia y q serían 3.000 euros de multa. Una vergüenza de trato el de esa señora. Estaba ayer 31-7 a las 17:30-18:00 d la tarde en recepción. Una señora morena con gafas(su nombre lo desconozco).",,España,"5,0",En familia,Habitación Cuádruple Estándar,1/08/2021
838,Elisa,Bien,"Por motivos de reforma del hotel, nos pusieron en una habitación superior, de grandes dimensiones, la que habíamos reservado.",No funcionaba el aire acondicionado.,España,"7,0",En pareja,Habitación Doble - 1 o 2 camas,12/07/2021
839,Fco,No es 4 estrellas,Sin comentarios,"Cuarto de baño antiguo, no tiene bidet y la bañera ya no se lleva, dificultad para entrar y salir, sería mejor una ducha.",España,"6,0",En pareja,Habitación Doble - 1 o 2 camas,3/07/2021
840,Mònica,Ideal para famílias,"Para nosotros la ubicación es perfecta, también el tamaño de la habitación ya que somos una família de 5 miembros","Nada, ya me había alojado antes allí, no habría vuelto si no me hubiera gustado",España,"7,0",Persona que viaja sola,Habitación Familiar,1/07/2021
841,Carlos,Pésimo,Estaban en obras. No hay aviso. Ruidos de martillos a las 07:45,,España,"1,0",En familia,Habitación Triple,29/06/2021
842,Arturo,Agradable,Normal.,Estado de conservación.,España,"6,0",En familia,Habitación Doble - 1 o 2 camas,15/06/2021
843,Daniel,Céntrico y cómodo,"Está justo al lado de la avenida principal, de tiendas y restaurantes. La cama es cómoda y la habitación que nos dieron era muy amplia, con sofá y sala de estar. El wc muy limpio con ducha y también bañera.","El wifi no iba demasiado bien. Me tuvieron que que dar otra clave y ni así. Es decir, para trabajar no es el mejor hotel. Pedí tan solo 30minutos de late check out por motivos de trabajo pero nos dijeron que era imposible porque los de limpieza tenían turnos reducidos. Sí que nos dieron algo más de tiempo con el parking interior",España,"7,0",En pareja,Habitación Doble - 1 o 2 camas,22/05/2021
844,Eduard,para no volver,no cumplió expctativas,habitación muy deteriorada sábanas viejas . no nos facilitaron opción parking y estaba diluviando,España,"2,0",En pareja,Habitación Doble - 1 o 2 camas,14/05/2021
845,Lorena,40m2 a oscuras,Ubicación excelente.,"Habitación muy oscura, cama incomoda y la ducha incomoda porque sale agua mientras te duchas y se llena el suelo de agua y tienes que secarla tu con toallas que te proporciona el hotel de uso personal.",España,"6,0",En pareja,Habitación Doble - 1 o 2 camas,13/05/2021
846,Sandra,Bien,Precio del desayuno/persona,,España,"7,0",En familia,Habitación Cuádruple Estándar,11/05/2021
847,Maria,Agradable,"Ubicación inmejorable, personal muy atento y habitaciones muy grandes.",Los muebles de la habitación estaban viejos y muy muy rotos.,España,"6,0",En pareja,Habitación Doble - 1 o 2 camas,9/05/2021
848,Antonio,Agradable,"Personal muy amable, habitaciones amplias y muy céntrico","Desayuno un poco escaso , ya habíamos estado hace unos años y nada que ver (supongo que tiene que ver tema Covid). Las habitaciones son grandes y cómodas pero les hace falta una reforma(puertas....)",España,"7,0",En pareja,Habitación Doble - 1 o 2 camas,5/05/2021
849,Iris,Aceptable,La recepcionista muy simpática.,"Lo único que pedí fue cama de matrimonio ya que era una celebración y la petición no fue procesada 
Además las chicas de la limpieza hacen mucho ruido desde bien temprano y te despiertan...",España,"5,0",En pareja,Habitación Doble - 1 o 2 camas,25/04/2021
850,Javier,Agradable,"Buena ubicación aunque sin vistas, habitación muy amplia","El wifi funciona fatal, si necesitas trabajar no vayas. Ademas preguntamos en recepción como solucionarlo y la respuesta fue “ui el wifi va muy mal en toda andorra siempre... tendras que comprar un usb” entonces, si es asi, quita el servicio de wifi de la descripción del hotel mejor",España,"6,0",En pareja,Habitación Doble - 1 o 2 camas,17/04/2021
851,Mireia,Bien,Situacion y tamaño habitación,"Desayuno, teniendo en cuenta las medidas covid que toma el hotel.. el coste del desayuno debería ser más economico teniendo en cuenta la poca variedad que ofrecen",España,"7,0",En familia,Habitación Familiar,5/04/2021
852,Juan,Llamada de recepción durante la madrugada,En general la relación calidad-precio es buena.,"El recepcionista de la noche tenía muy mala actitud y llamó a mi habitación durante la madrugada pensando que estaba de fiesta. Antes de llamar a acusar, debería asegurarse cual es la habitación que estaba de fiesta porque me ha despertado cuando tenia madrugar para reuniones importantes y me ha fastidiado mi sueño. Más cuidado de lanzar acusaciones sin estar seguro.",España,"7,0",En pareja,Habitación Doble - 1 o 2 camas,15/03/2021
853,Victor,Agradable,Ubicación,"El desayuno escaso.
Mucho calor en las habitaciones y almohada incómoda.
Limpieza",España,"6,0",En grupo,Habitación Triple,15/03/2021
854,Lucas,Bien,"Bien situado, cómodo",Un poco antiguo,España,"7,0",En pareja,Habitación Doble - 1 o 2 camas,25/02/2021
855,Alejandra,"Bad attention, NO RECOMENDABLE","Me a parecido que no cumple con los requisitos minimos, el hotel, brinda una atencion muy pobre, el concerje del hotel un señor que habia en el turno de noche, me trato con un vocavulario totalmente inadecuado porque no encontraba mi reserva en el hotel, me dijo palabras textuales como (no me queda otra que dejarte entrar,acompañados de una gesticulación inapropiada).","la atención malisima, el que se tenga que pagar 18€ por el parking lo encontre desmesurado. 
definitivamnete muy mala la atención pero sobre todo el personal, el hombre que estuvo de guardia por la noche el martes 16 de feb.",España,"1,0",En pareja,Habitación Doble - 1 o 2 camas,18/02/2021
856,Hector,Alojamiento,"Pagamos una habitación estándar y nos metieron en una familiar sin recargo, personal del hotel muy amables y profesionales","Para tener 4 estrellas hay que renovarse, una Tv con 15 canales, la mampara del baño inútil con el regulador de temperatura roto, el otro baño que teníamos perdía por la junta del plato de ducha y se encharcaba.. muebles que han pasado a mejor vida y sobretodo las puertas de cartón piedra.",España,"7,0",En pareja,Habitación Doble - 1 o 2 camas,15/02/2021
857,Laia,Excelente habitación poca limpieza,"Un horror la limpieza del hotel, no es para nada un hotel de 4 estrellas, muebles y suelo mal",,España,"4,0",En grupo,Habitación Doble - 1 o 2 camas,9/02/2021
858,Jenifer,buen alojamiento,Estubo bien por precio,que no entraba desayuno,España,"7,0",En pareja,Habitación Triple (2 adultos + 1 niño),31/01/2021
859,Francisco,Decepcionante,Buena ubicación muy cerca del centro,"Habitacion muy desvencijada , la nevera en funcionamiento pero muy sucia, mobiliario de la habitación en mal estado,necesita una buena reforma ,no cumple las expectativas de un hotel de 4 estrellas",España,"4,0",Persona que viaja sola,Habitación Doble - 1 o 2 camas,19/01/2021
860,Maria,Aniversario bien personal turno noche mal,La habitación,Que no pude cenar ni desayunar,España,"7,0",En pareja,Habitación Doble - 1 o 2 camas,10/01/2021
861,Meritxell,No es un 4 estrellas ni se le acerca.,La cama era cómoda.,"Habitación y sobretodo el baño sucio. Puertas destartaladas. Como artículo de aseo únicamente dos botes de gel que servia como champú, unos pañuelos y una pastillita de jabón (1 pack por baño). En el piknic del desayuno 1 mini bote de leche por persona (tamaño dedal de coser) y nada de cacao soluble... con dos niñas muy mal, hemos tenido que buscar desayuno fuera.",España,"3,0",En familia,Habitación Cuádruple Estándar,10/01/2021
862,Marc,Un poquito por debajo de mis espectativas,"La habitación era muy grande, contaba con 2 baños; uno con ducha y el otro con bañera.
La cama también era grande y bastante comoda.","Habitaciones poco insonorizadas. 
Había bastantes detalles que te hacían ver que el hotel necesita una reforma. Muebles gastados, alguna humedad en los baños, decoración un pelín anticuada…",España,"5,0",En pareja,Habitación Doble - 1 o 2 camas,7/01/2021
863,Juan,Bien,la situacion es buena,el hotel es bastante antiguo y no tiene muchas comodidades. mueble muy viejos. cuarto de baño también viejo,España,"7,0",En pareja,Habitación Doble - 1 o 2 camas,6/01/2021
864,David,Bien,Servicio del Restaurante su comida y sobre todo su personal,Algunos de su recepcionistas con mucha carencia de empatía y vocación de servicio ( muy mejorable),España,"7,0",Persona que viaja sola,Habitación Doble - 1 o 2 camas,5/01/2021
865,Rafa,No es un hotel de 4 estrellas,"Visto lo visto en Andorra las estrellas las regalan. No es un hotel de 4 estrellas. Es muy sencillo. 
La ubicación muy buena. El desayuno básico.","El wifi es malísimo, en las habitaciones apenas llega la conexión. Los muebles y las puertas necesitan un arreglo.",España,"6,0",En pareja,Habitación Doble - 1 o 2 camas,4/01/2021
866,Aida,Bien,Las habitaciones muy cómodas,"Todo bien, salvo la conexión a internet. Solo funcionaba en la recepción y no hubo manera de poder trabajar en la habitación y el personal de la tarde no lo supo gestionar ni solucionar",España,"7,0",Persona que viaja sola,Habitación Individual,25/12/2020
867,Emilia,Muy antipáticos en recepción,Alguien debería formar a los recepcionistas. Hablan sin mirar a la persona que les habla. No saludan . Alucinante,,España,"7,0",En pareja,Habitación Doble - 1 o 2 camas,24/11/2020
868,Miguel,Decepcionante,El servicio de Cafeteria,,España,"4,0",En pareja,Habitación Doble - 1 o 2 camas,22/10/2020
869,Carmen,Bien,"Quiero pensar que otros días el trato del personal que se encuentra en recepción se dirige a los huéspedes con mejores formas y mas empatía no obstante este pequeño detalle no lo puedo corroborar porque lamentándolo mucho no ha sido así.  
Nos vemos pronto",,España,"7,0",En pareja,Habitación Doble - 1 o 2 camas,18/10/2020
870,David,Aceptable,El mobiliario y baños viejos,,España,"5,0",En familia,Habitación Doble - 1 o 2 camas,11/10/2020
871,Ferran,Bien,TIENE UNA UBICACIÓN EXCELENTE.,,España,"7,0",En familia,Habitación Cuádruple Estándar,28/09/2020
872,Anaïs,Muy mal,El personal del desayuno,La decoración y limpieza,España,"2,0",En pareja,Habitación Doble - 1 o 2 camas,27/09/2020
873,Jaume,"Hotel muy recomendable, al menos por la habitación que nos pusieron y por su precio.","Habitación muy grande con dos baños y 2 estancias y 2 televisiones.
La ubicación es buena estando muy cerca de la calle comercial.","Habia cosas muy de batalla, con desperfectos, rotas o muy usadas que deberian haberse cambiado.
Entiendo que pasa mucha gente y que no todos son cuidadosos, pero por relación calidad-precio no creo que pueda pedirse mucho más.",España,"7,0",En familia,Habitación Triple,14/09/2020
874,Almudena,Agradable,Las habitaciones y limpieza,El trato de la recepción no fue nada amable,España,"6,0",En familia,Habitación Triple,11/09/2020
875,Francisco,Bien,"La habitacion era amplia y comoda
Que hubiera 2 baños
La localizacion
Medidas anti COVID bien implementadas","El wifi no iba en la habitacion
No tuvimos opcion a reservar cenas una vez llegamos al hotel, ni tan solo el dia de la fiesta de Meritxell, aunque habia pocos restaurantes abiertos y el restaurante del hotel estaba casi vacio.
Habia ropa interior de algun huesped anterior olvidada en el armario del cuarto de baño
Los ascensores iban mal, tuvimos que usar las escaleras muchas veces, las cuales no estaban contrastadas y a nuestra hija, que tiene problemas visuales le resulto dificultoso",España,"7,0",En familia,Habitación Familiar,10/09/2020
876,Nerea,Decepcionante,El desayuno no era muy bueno y mis amigos no tenían aire acondicionado! Les dieron un ventilador y tampoco funcionaba. Llegamos a las 16h y aún no tenían las habitaciones listas. No fue una buena experiencia,,España,"4,0",En grupo,Habitación Doble - 1 o 2 camas,7/09/2020
877,Alberto,Aceptable,La habitación era grande.,"Aire acondicionado no funcionaba bien, olores por el desagüe del baño pequeño, un día sin poder ver la TV por que el mando no funcionaba, la atención de la señora de recepción un poco sosa. En ningún sitio ponía la extensión de teléfono para llamar a recepción. Poca variedad y calidad del desayuno.",España,"5,0",En grupo,Habitación Cuádruple Estándar,6/09/2020
